text,label
"Sickle cell disease is a genetic blood disorder characterized by red blood cell misshapenness, due to the abnormal hemoglobin (Hb) structure. This affects 100,000 individuals in the USA and millions worldwide, often leading to premature death due to painful episodes or organ damage. Currently, treatments only alleviate symptoms rather than addressing the underlying genetic cause. Recent advances in CRISPR-Cas9 genome editing technology have made it possible to precisely correct genetic diseases at their source. Here we report the efficient use of CRISPR-Cas9 to correct the sickle cell disease-associated β globin gene mutation in human induced pluripotent stem cells (hiPSCs) derived from patients. By transiently introducing the CRISPR-Cas9 system into hiPSCs, we were able to correct the HBB (β globin) gene mutation via non-homologous end joining (NHEJ), with high efficiency, using an intron-targeting approach. We also report a novel, targeted integration approach to further increase the probability of correction. We demonstrate that corrected cells maintain pluripotency and develop into",0
"Over the past decade, the advent of next-generation sequencing (NGS) has led to the identification of novel mutations in many hereditary breast cancer (BC) families. A family history of breast cancer is a significant risk factor for BC development, especially if the tumors are triple-negative (TN) and in women under 50 years of age. We previously identified a BRCA1 c.298del (p.Lys100Argfs∗3) mutation in one family with an autosomal-dominant pattern of inheritance. In this study, we investigated the role of this mutation in BC development and progression.",0
"Title: CRISPR-Cas9-Based Gene-Editing Therapy for Sickle Cell Disease: A New Dawn for Patients Worldwide? Background: Sickle cell disease (SCD), a prevalent autosomal recessive genetic disorder caused by a mutation in the beta-globin gene (HBB), affects millions worldwide. Characterized by a range of complications resulting from abnormal sickling of red blood cells, SCD is a leading cause of early morbidity and mortality, particularly among the pediatric population. Current treatment options are limited to lifelong blood transfusions, hydroxyurea, and chronic opioid use. Recent advances in CRISPR-Cas9-based gene editing therapies have been heralded as a revolutionary approach for the treatment of many genetic diseases, and researchers have begun to explore the potential for this technology to target SCD.",0
"Tau protein aggregation is a pathological hallmark of Alzheimer’s disease (AD), but its role in frontotemporal dementia (FTD) is unclear. The objectives of this study were to investigate tau protein aggregation patterns in FTD and determine their relationship with clinical and cognitive performance.",0
"Background: The emergence of coronavirus disease 2019 (COVID-19) has led to a global pandemic with over 100 million infections and 2.5 million deaths worldwide (as of January 2021). As a result, multiple COVID-19 vaccines have been developed in a time-efficient manner. One such vaccine is BNT162b2 mRNA vaccine, an mRNA-based vaccine that targets the spike protein of severe acute respiratory syndrome coronavirus 2 (SARS-CoV-2).",0
"Background: The recent advances in high-throughput RNA-sequencing (RNA-seq) technology have enabled comprehensive transcriptomic profiling of tumors, providing significant insights into the molecular mechanisms underlying tumorigenesis. The RNA-seq data analysis is a rapidly evolving field, and many computational approaches have been developed for the analysis of RNA-seq data. Despite the advances in RNA-seq technologies and data analysis methods, a comprehensive analysis of tumor heterogeneity and its molecular mechanisms is still difficult to achieve due to the lack of integrative analysis tools that can effectively handle the complex and heterogeneous nature of tumor tissues.",0
"Deep Brain Stimulation (DBS) is an accepted and effective treatment for Parkinson's disease (PD) . DBS targets the subthalamic nucleus (STN), a key structure in the pathophysiology of PD . DBS is used in medically refractory cases in which dopaminergic drugs fail to reduce motor complications .",0
"the recognition of colonization pressure as an important risk factor for acquisition of antibiotic - resistant bacteria in the icu , including acinetobacter species , has major consequences for our understanding of risk factor analyses . moreover , the importance of colonization pressure underpins the role of cross - transmission in the dynamics of antibiotic - resistant bacteria in the icu , which has major consequences for the evaluation of the effectiveness of infection control measures .",1
"Background: Rheumatoid arthritis (RA) is a chronic, systemic autoimmune disease characterized by inflammation of joints that causes joint pain, stiffness, and swelling, resulting in impaired mobility. The pathogenesis of RA involves interactions between various immune cells and the activation of inflammatory cytokines, such as interleukin-6 (IL-6). Excessive production of IL-6 leads to chronic inflammation and joint destruction in RA patients. Targeted therapies aimed at reducing IL-6 signaling have shown clinical success, but the precise mechanisms by which IL-6 signaling drives RA pathogenesis are not fully understood.",0
"the development of imaging methodologies for detecting blood - brain - barrier ( bbb ) disruption may help predict stroke patient 's propensity to develop hemorrhagic complications following reperfusion . we have developed a delayed contrast extravasation mri - based methodology enabling real - time depiction of subtle bbb abnormalities in humans with high sensitivity to bbb disruption and high spatial resolution . the increased sensitivity to subtle bbb disruption is obtained by acquiring t1-weighted mri at relatively long delays ( ~15 minutes ) after contrast injection and subtracting from them images acquired immediately after contrast administration . in addition , the relatively long delays allow for acquisition of high resolution images resulting in high resolution bbb disruption maps . the sensitivity is further increased by image preprocessing with corrections for intensity variations and with whole body ( rigid+elastic ) registration . since only two separate time points are required , the time between the two acquisitions can be used for acquiring routine clinical data , keeping the total imaging time to a minimum.a proof of concept study was performed in 34 patients with ischemic stroke and 2 patients with brain metastases undergoing high resolution t1-weighted mri acquired at 3 time points after contrast injection . the mr images were pre - processed and subtracted to produce bbb disruption maps . bbb maps of patients with brain metastases and ischemic stroke presented different patterns of bbb opening . the significant advantage of the long extravasation time was demonstrated by a dynamic - contrast - enhancement study performed continuously for 18 min . the high sensitivity of our methodology enabled depiction of clear bbb disruption in 27% of the stroke patients who did not have abnormalities on conventional contrast - enhanced mri . in 36% of the patients , who had abnormalities detectable by conventional mri , the bbb disruption volumes were significantly larger in the maps than in conventional mri.these results demonstrate the advantages of delayed contrast extravasation in increasing the sensitivity to subtle bbb disruption in ischemic stroke patients . the calculated disruption maps provide clear depiction of significant volumes of bbb disruption unattainable by conventional contrast - enhanced mri .",1
"an 84-year - old woman presented to our hospital with dyspnea on exertion and left back pain . chest x - ray and chest computed tomography ( ct ) revealed an irregular pleural mass invading her left chest wall with rib destruction and pleural effusion . ct - guided needle biopsy revealed diffuse large b - cell lymphoma . low - dose oral etoposide produced a complete response , and she continued oral chemotherapy for one year after the diagnosis and maintained good performance status . we herein report a very rare case of non - pyothorax - associated lymphoma that nonetheless resulted in great recovery .",1
"Title: A CRISPR‐Based Therapy for Treating Sickle Cell Disease: Targeting HBG to Alleviate Hemolysis and VOC Events. 1 , 2 , 3 , 4 1 Biology Department, University of Illinois at Chicago, Chicago, IL, USA. 2 Department of Medicine, University of Illinois at Chicago, Chicago, IL, USA. 3 Heart Institute, University of Illinois at Chicago, Chicago, IL, USA. 4 Department of Pediatrics and Children's Hospital, University of Illinois at Chicago, Chicago, IL, USA.",0
"Title: CRISPR-Cas9 Gene Editing for Sickle Cell Disease with Reduced Off-Target Effects. Background: Sickle cell disease (SCD) is a genetic disorder characterized by painful episodes known as crises due to abnormal hemoglobin. A single nucleotide polymorphism (A→T) in the gene encoding the β-globin chain results in sickle-shaped red blood cells. Current treatments such as bone marrow transplantation are costly and have limited accessibility. Gene editing with CRISPR-Cas9 is a potential cure for SCD. However, off-target effects, or unwanted gene editing in unintended sites, have been a significant concern with CRISPR-Cas9 therapy.",0
"Background: Diabetic retinopathy (DR) is a leading cause of blindness in the developed world and is associated with the development of retinal neovascularization, a process that can be stimulated by vascular endothelial growth factor (VEGF). Therefore, we investigated the efficacy of ranibizumab, a monoclonal antibody against VEGF, in patients with DR.",0
"In this study, we aimed to evaluate the efficacy of KRAS G12C inhibitors in colorectal cancer. We used a combination of in vitro and in vivo models to assess the effects of these inhibitors on KRAS G12C mutant colorectal cancer cells.",0
"electrostatic interactions play an important role in enzyme catalysis by guiding ligand binding and facilitating chemical reactions . these electrostatic interactions are modulated by conformational changes occurring over the catalytic cycle . herein , the changes in active site electrostatic microenvironments are examined for all enzyme complexes along the catalytic cycle of escherichia coli dihydrofolate reductase ( ecdhfr ) by incorporation of thiocyanate probes at two site - specific locations in the active site . the electrostatics and degree of hydration of the microenvironments surrounding the probes are investigated with spectroscopic techniques and mixed quantum mechanical / molecular mechanical ( qm / mm ) calculations . changes in the electrostatic microenvironments along the catalytic environment lead to different nitrile ( cn ) vibrational stretching frequencies and 13c nmr chemical shifts . these environmental changes arise from protein conformational rearrangements during catalysis . the qm / mm calculations reproduce the experimentally measured vibrational frequency shifts of the thiocyanate probes across the catalyzed hydride transfer step , which spans the closed and occluded conformations of the enzyme . analysis of the molecular dynamics trajectories provides insight into the conformational changes occurring between these two states and the resulting changes in classical electrostatics and specific hydrogen - bonding interactions . the electric fields along the cn axes of the probes are decomposed into contributions from specific residues , ligands , and solvent molecules that make up the microenvironments around the probes . moreover , calculation of the electric field along the hydride donor acceptor axis , along with decomposition of this field into specific contributions , indicates that the cofactor and substrate , as well as the enzyme , impose a substantial electric field that facilitates hydride transfer . overall , experimental and theoretical data provide evidence for significant electrostatic changes in the active site microenvironments due to conformational motion occurring over the catalytic cycle of ecdhfr .",1
"subintimal angioplasty is an effective method for the treatment of long superficial femoral artery ( sfa ) occlusions . one of the major limiting factors for the success of this procedure is the failure to re - enter the true lumen . the recently introduced luminal re - entry devices provide a high technical success rate , but failures can occur . in such cases , a retrograde popliteal approach can serve as a potential backup option . however , the need to reposition the patient remains a drawback . here , we report a case of an 81-year - old male with a long sfa occlusion treated using a retrograde distal sfa approach in the supine position after the initial failure of antegrade angioplasty .",1
"Background: Hepatocellular carcinoma (HCC) is a common liver cancer with poor survival. The early diagnosis of HCC is difficult, and therefore, patients are frequently diagnosed at late stages. Better markers for diagnosis and prognosis of HCC are needed. Gene expression profiling (GEP) has been used to identify genes and genetic pathways that are associated with the progression of HCC. However, the association between the genetic pathways and the prognosis of patients with HCC has not been well-studied.",0
"The pathophysiology of inflammatory bowel disease (IBD) is multifactorial, involving both genetic and environmental factors. It has been suggested that disruption of the intestinal microbiome composition may play a role in the development of IBD. This study examined the composition of the gut microbiome in patients with IBD and matched controls. In the patient group, there was a significant increase in the relative abundance of several bacterial genera associated with inflammation, including Escherichia and Shigella. Additionally, there was a significant decrease in the relative abundance of several bacterial genera associated with beneficial gut microbiota, including Roseburia and Bifidobacterium. These findings suggest that alterations in the gut microbiome composition may play a role in the development of IBD. These results have important implications for the prevention and treatment of IBD and highlight the potential role of microbiome-targeted therapies.",0
Purpose: Glioblastoma (GBM) is the most malignant primary brain tumor with a dismal prognosis. Understanding the cellular heterogeneity and identifying biomarkers for different cell types in GBM are crucial for the development of targeted therapies. RNA sequencing (RNA-seq) analysis offers a powerful approach to study tumor heterogeneity. This study aimed to analyze the expression of immune-related genes and immune infiltration in GBM.,0
"large scale clinical trials demonstrate significant reductions in cardiovascular event rates with statin therapy . the observed benefit of statin therapy , however , may be larger in these trials than that expected on the basis of lipid lowering alone . emerging evidence from both clinical trials and basic science studies suggest that statins have anti - inflammatory properties , which may additionally lead to clinical efficacy . measurement of markers of inflammation such as high sensitivity c - reactive protein in addition to lipid parameters may help identify those patients who will benefit most from statin therapy .",1
"background and objective . to determine the value of repeated brain ct in tbi cases for risk - stratified care management ( rscm ) and to identify predicting factors which will change the neurosurgical management after repeated brain cts . methods . a 5-year retrospective study from january 2009 to august 2013 was conducted . the primary outcome was the value of repeated brain ct in tbi cases . the secondary outcome is to identify predicting factors which will change the neurosurgical management after repeated brain cts . results . there were 145 consecutive patients with tbi and repeated brain ct after initial abnormal brain ct . forty - two percent of all cases ( n = 61 ) revealed the progression of intracranial hemorrhage after repeated brain ct . in all 145 consecutive patients , 67.6% of cases ( n = 98 ) were categorized as mild tbi . for mild head injury , 8.2% of cases ( n = 8) had undergone neurosurgical management after repeated brain ct . only 1 from 74 mild tbi patients with repeated brain ct had neurosurgical intervention . clopidogrel and midline shift more than 2 mm on initial brain ct were significant predicting factors to indicate the neurosurgical management in mild tbi cases . conclusion . routine repeated brain ct for rscm had no clinical benefit in mild tbi cases .",1
"r3d - blast is a blast - like search tool that allows the user to quickly and accurately search against the pdb for rna structures sharing similar substructures with a specified query rna structure . the basic idea behind r3d - blast is that all the rna 3d structures deposited in the pdb are first encoded as 1d structural sequences using a structural alphabet of 23 distinct nucleotide conformations , and blast is then applied to these 1d structural sequences to search for those rna substructures whose 1d structural sequences are similar to that of the query rna substructure . r3d - blast takes as input an rna 3d structure in the pdb format and outputs all substructures of the hits similar to that of the query with a graphical display to show their structural superposition . in addition , each rna substructure hit found by r3d - blast has an associated e - value to measure its statistical significance . r3d - blast is now available online at http://genome.cs.nthu.edu.tw/r3d-blast/ for public access .",1
"we report a case of recurrent streptococcus pneumoniae meningoencephalitis with a transethmoidal meningoencephalocele ( teme ) but without cerebrospinal fluid ( csf ) leakage.a 35-year - old man was admitted with s. pneumoniae meningitis . he had suffered from four episodes of recurrent pneumococcal meningitis during the previous 4 years . a computed tomography scan of the paranasal sinus showed the teme protruding through a bony defect of the right frontal base . however , the patient did not have symptoms that could be attributable to csf leakage , and radioisotope cisternography did not identify a leak . brain magnetic resonance imaging revealed cortical lesions overlying the teme , and electroencephalography revealed epileptiform discharges in frontal regions . appropriate antibiotics therapy without steroids was given to improve his condition.the presented case suggests that even in the absence of clinically demonstrable csf leakage , an occult skullbase defect and its associated meningoencephalocele should be considered in patients with recurrent bacterial meningitis .",1
"Background: Chronic kidney disease (CKD) is a progressive condition that can lead to end-stage renal disease, which has a major impact on public health and mortality. Biomarkers play an important role in diagnosing and monitoring CKD progression. The gold standard for CKD diagnosis is a combination of renal function tests and albuminuria. However, these markers are not very sensitive in detecting early CKD. Therefore, there is a need to identify more sensitive biomarkers that can detect early CKD.",0
"epidermal inclusion cysts are formed by inclusion of keratinizing squamous epithelium within the dermis , resulting in a cyst filled with lamellated keratin . these benign cysts are usually very small and intradermal subcutaneous lesions . they can occur anywhere in the body although they are more common on the face , trunk , neck , extremities and scalp . only a few cases of epidermal cysts of the breast have been reported in the literature . an epidermal inclusion cyst of the breast can result in several problems , even if the size is unusual . we encountered a case of a giant sized epidermal inclusion cyst of the breast initially mimicking a large fibroadenoma or phyllodes tumor .",1
"In this study, we conducted a comprehensive analysis of the SARS-CoV-2 spike protein to identify potential factors contributing to long COVID symptoms. We used multiple in vitro and in vivo experiments to elucidate the role of the SARS-CoV-2 spike protein in long COVID symptoms. Our results suggest that the SARS-CoV-2 spike protein can trigger an immune response that persists long after the initial infection, leading to long COVID symptoms. We also found that the SARS-CoV-2 spike protein can cause tissue damage and inflammation, which can contribute to long COVID symptoms. Our findings provide new insights into the pathogenesis of long COVID and identify potential therapeutic targets for the treatment of long COVID.",0
"background and aims : priming principle refers to administration of a small dose of non - depolarising blocker , which when followed by a large intubating dose produces a relatively rapid and profound blockade to ensure suitable conditions for endotracheal intubation . we aimed to compare the effects of rocuronium , vecuronium , and atracurium as pretreatment drugs on intubating conditions with rocuronium facilitated endotracheal intubation.methods:this double - blinded , randomised controlled prospective study was carried out at a tertiary health care hospital on patients undergoing surgical procedures under general anaesthesia . they were randomly allocated into three groups ( n = 35 ) by computer generated randomisation chart to receive either rocuronium ( 0.06 mg / kg body weight ) ( group a ) ; vecuronium ( 0.01 mg / kg body weight ) ( group b ) or , atracurium ( 0.05 mg / kg body weight ) ( group c ) , followed by intubating dose ( 0.6 mg / kg body weight ) of rocuronium . the haemodynamic parameters and intubating conditions were studied and statistically analysed by anova test and student 's t - test as applicable using statistical package for the social sciences 16.0 for windows ( spss inc . , chicago , il , usa).results : excellent intubating conditions were noted in maximum number of patients in group c ( 97.41% ) . no significant differences were observed in the systolic blood pressure in all the three groups at all - time intervals . the mean arterial pressure rose significantly from baseline value to maximum , at 0 min in all the groups ; however , no significant difference was observed amongst the groups ( p > 0.05).conclusion : pretreatment with rocuronium bromide can facilitate endotracheal intubation in 60 s irrespective of non - depolarising muscle relaxants used for priming ; however , it can not attenuate haemodynamic changes associated with laryngoscopy and intubation .",1
"manned space flight induces a reduction in immune competence among crew and is likely to cause deleterious changes to the composition of the gastrointestinal , nasal , and respiratory bacterial flora , leading to an increased risk of infection . the space flight environment may also affect the susceptibility of microorganisms within the spacecraft to antibiotics , key components of flown medical kits , and may modify the virulence characteristics of bacteria and other microorganisms that contaminate the fabric of the international space station and other flight platforms . this review will consider the impact of true and simulated microgravity and other characteristics of the space flight environment on bacterial cell behavior in relation to the potential for serious infections that may appear during missions to astronomical objects beyond low earth orbit .",1
"background : hbv infection is a major global health problem and ten genotypes ( a to j ) and multiples subtypes of hbv have been identified , and they show some distinct geographic distributions . the available data on hbv genotype in iran are very heterogeneous and limited . therefore in this study , we tried to identify the hbv genotypes by using polymerase chain reaction.methods:in this cross - sectional study , hbv- positive serum samples of 122 patients with chronic hepatitis from 2011 to 2014 were studied . hbv - dna was extracted from plasma samples using qiaamp minielute virus spin kit ( qiagen ) . plasma samples from hbsag positive were confirmed the presence of hbv nucleic acid and determined the genotypes of hbv genome by pcr using the dna pcr kit ( cinagene ) with taq - dna polymerase enzyme and type of specific primers . all samples were examined in the virology laboratory of sari medical school.results:the mean age of patients were 45 25 ( range , 20 to 70 ) year that 70 ( 57.37% ) patients were male and 52 ( 42.62% ) were female . the majority of hbv positive patients had a major surgery ( 44% patients ) and then 32% patients followed by intra familial of hepatitis b virus infected and 11% of hbv positive patients had a history of blood transfusions . in this study , 91(74.59% ) had genotype d , 7(5.73% ) genotype b and 24(19.67% ) genotype d and b.conclusion:this study indicates that the genotype d is the most frequent followed by the mixed genotypes d and b and genotype b in our region . prevalence and incidence of hbv genotypes are with distributed among of areas and different genotypes may show different responses with antiviral therapy .",1
