text,label
"genetic research in sports has a history of more than 40 years of endeavouring to find out which genetic factors can predict the performance of an athlete . with increasing knowledge of the human genome and availability of genetic testing the market of direct - to - consumer genetic tests has exploded in recent years . there are tests for genetic variants for medical and general health issues , but there are also ' lifestyle ' tests , including tests for indicators for sport performance . the human gene map for fitness and performance includes hundreds of genes that play a role in cardiorespiratory endurance , muscle strength , exercise tolerance , body composition and energy metabolism . however , there is currently no evidence that genotyping an individual is superior to traditional physiological tests in predicting athletic performance.the impact of genetic test results is much higher in certain medical conditions which are associated with significant health risks when performing competitive sport . these are generally rare inherited disorders , mostly resulting in cardiovascular dysfunction . there are major ethical issues as to whether genetic or clinical pre - participation screenings should be applied to the population in order to prevent disease or death during sport . some of these issues will be addressed in this article .",1
Background: Non-small cell lung cancer (NSCLC) is one of the leading causes of cancer-related deaths worldwide. The epidermal growth factor receptor (EGFR) is overexpressed in many NSCLC tumors. EGFR overexpression is associated with poor prognosis and a high rate of metastasis.,0
"introduction : brain metastases ( bm ) occur in up to one - fifth of patients with metastatic breast cancer ( mbc ) . imaging plays a key role in diagnosis . the pattern and distribution of these changes are also crucial to their management . these patterns have not been fully studied in nigerian women.materials and methods : retrospective analysis of the findings on the cranial computed tomography ( ct ) scans performed in 59 breast cancer patients with suspected bm treated at the university teaching hospital in ibadan , between 2005 and 2010 . the imaging features were evaluated in relation to their clinical characteristics.results:in the 59 patients studied ( mean age 50.9 years 11.75 sd ) , headache ( 40.7% ) and hemiparesis / hemiplegia ( 16.9% ) were the commonest clinical presentation . lytic skull lesions were seen in 15 patients ( 25.4% ) , most commonly in the parietal bones . thirty - nine patients ( 66.1% ) , had parenchymal brain lesions , and only 8 ( 20.5% ) of these were single lesions . most of the lesions were isodense ( 19/39 ; 51.4% ) the parietal lobe was the most common site with 50.8% ( 30/59 ) occurrence and the leptomeninges the least with 13.6% ( 8/59 ) . orbital or sellar region involvement occurred in only two patients . the size of the lesions , was 5 cm in 5 patients . sixteen ( 27.1% ) patients were free of any lesion either in the skull or brain . patient presenting with multiple brain lesions were more likely to have skull lesions though this was not statistically significant ( p = 0.584).conclusion : the brain continues to be a sanctuary site for breast cancer metastases and ct imaging remains an invaluable tool in the clinical evaluation and therapeutic management of nigerian women with bm from mbc . it also appears that the demographic and imaging findings in these patients are similar to other racial groups .",1
"background : micronuclei in exfoliated oral epithelial cells have been shown in some studies to correlate with severity of this genotoxic damage . this severity can be measured in terms of grading of the lesions.aim:to correlate frequency of micronuclei ( mn ) in oral exfoliated cells in clinically diagnosed cases of oral squamous cell carcinoma ( oscc ) followed by a histopathological grading.materials and methods : the study subjects consisted of clinically diagnosed cases of oscc . healthy subjects without any tobacco consumption habits formed the control group . the cytosmears from both groups were stained with rapid papanicolaou stain . mn were identified according to the criteria given by countryman and heddle with some modifications.results:the frequency of mn was three to four times higher in patients with oscc as compared to patients in the control group and the difference was found to be highly significant . in 75% cases , the cytological grade as determined by the frequency of micronuclei correlated with the histopathological grade and this observation was statistically significant.conclusions:mn can be a candidate to serve as a biomarker for prediction of the grade of oscc .",1
"Inherited BRCA1 mutations are associated with a high lifetime risk of breast cancer. Women with BRCA1 mutations are also at increased risk for triple-negative breast cancer (TNBC), which is characterized by lack of expression of three common tumor biomarkers, namely estrogen receptor (ER), progesterone receptor (PR), and human epidermal growth factor receptor 2 (HER2). The purpose of this study was to evaluate the association of BRCA1 mutations with TNBC. We analyzed tumor biomarker expression data from 884 women with breast cancer and genotype data from 785 women with breast cancer from a breast cancer cohort in the United States. We identified 62 women with BRCA1 mutations and 822 women without BRCA1 mutations who had data on ER, PR, and HER2 status. We used multinomial logistic regression to estimate the odds ratio (OR) and 95% confidence interval (CI) of BRCA1 mutations for TNBC. We found a significant association of BRCA1 mutations with TNBC compared to other subtypes of breast cancer",0
"a 45-year - old man presented with binocular diplopia in primary gaze for 1 year . orthoptic evaluation showed 10-prism diopter right eye hypotropia and 6-prism diopter right eye esotropia . the elevation and abduction of the right eye were mechanically restricted . this was associated with systemic features suggestive of acromegaly . magnetic resonance imaging ( mri ) of the brain demonstrated a pituitary macroadenoma . an elevated serum insulin - like growth factor i level and the failure of growth hormone suppression after an oral glucose load biochemically confirmed the diagnosis of acromegaly . computed tomography ( ct ) of the orbit demonstrated bilateral symmetrical enlargement of the medial rectus and inferior rectus muscle bellies . all tests regarding graves - basedow disease were negative . although rare , diplopia due to a restrictive extraocular myopathy could be the presenting symptom of acromegaly .",1
"Background: Lung cancer is the most common cause of cancer death worldwide. Non-small cell lung cancer (NSCLC) accounts for approximately 85% of all lung cancer cases. Epidermal growth factor receptor (EGFR), a transmembrane tyrosine kinase, is expressed in lung epithelial cells, and plays a crucial role in the development of NSCLC. Abnormal activation of EGFR through gene mutation or overexpression leads to tumor proliferation and progression. EGFR mutations are found in approximately 50% of NSCLC patients in Asia, which is higher than those observed in Western populations.",0
"multiple myeloma is a b - cell origin tumor characterized by hypercalcemia , osteolytic bony lesions , and pathologic fractures . back pain is one of the most common presenting symptoms of multiple myeloma and about 60% of patients have vertebral involvement at the time of diagnosis7 ) . minimally invasive surgeries such as vertebroplasty and kyphoplasty are effective to relieve pain and improve the quality of life when a compression fracture occurs in multiple myeloma patients . we report a case of continuous multiple compression fractures associated with multiple myeloma . we should check for the possibility of pathologic vertebral fractures resulting from multiple myeloma in non - osteoporotic compression fracture patients , and especially in cases of continuous fracture occurring in relatively non - elderly patients , even though a history of trauma may be present .",1
"Title: Newly Identified IL-6 Signaling Pathway Offers Targeted Therapy for Rheumatoid Arthritis. Abstract: Rheumatoid arthritis (RA) is a systemic autoimmune disorder characterized by chronic inflammation and synovial destruction in joints. Treatment with disease-modifying antirheumatic drugs (DMARDs), such as methotrexate (MTX), is currently the primary standard of care for patients with RA. However, up to 40% of patients are unresponsive to MTX, leaving a significant clinical need for more effective therapeutic options.",0
"summarybackgroundto identify a parameter to distinguish normal hearing from hearing impairment in the early stages . the parameter was obtained from transient - evoked otoacoustic emissions ( teoaes ) , overcoming the limitations of the usually adopted waveform descriptive parameters which may fail in standard clinical screenings.material/methodsaudiometric examinations and teoae analysis were conducted on 15 normal ears and on 14 hearing - impaired ears that exhibited an audiometric notch around 4 khz . teoae signals were analyzed through a multivariate technique to filter out the individual variability and to highlight the dynamic structure of the signals . the new parameter ( named radius 2-dimension rad2d ) was defined and evaluated for simulated teoae signals modeling a different amount of hearing impairment.resultsaudiometric examinations indicated 14 ears as impaired - hearing ( ih ) , while the teoae ilo92 whole reproducibility parameter ( wwr ) indicated as ih 7 signals out of 14 ( 50% ) . the proposed new parameter indicated as ih 9 signals out of 14 ( 64% ) , reducing the number of false negative cases of wwr.conclusionsin this preliminary study there is evidence that the new parameter rad2d defines the topology and the quantification of the damage in the inner ear . the proposed protocol can be useful in hearing screenings to identify hearing impairments much earlier than conventional pure tone audiometry and teoae pass / fail test .",1
"Background: Lung cancer remains the leading cause of cancer-related deaths worldwide. Non-small cell lung cancer (NSCLC) comprises approximately 85% of all lung cancers and has a poor prognosis. Activation of the epidermal growth factor receptor (EGFR) signaling pathway plays a critical role in NSCLC carcinogenesis. EGFR tyrosine kinase inhibitors (TKIs) have been clinically approved for advanced NSCLC treatment. However, they have limited therapeutic responses and a high risk of drug resistance.",0
"although pharmacotherapy with atypical antipsychotics is common in child psychiatry , there has been little research on this issue . to compare the efficacy and safety of risperidone and aripiprazole in the treatment of preschool children with disruptive behavior disorders comorbid with attention deficit - hyperactivity disorder ( adhd ) . randomized clinical trial conducted in a university - affiliated child psychiatry clinic in southwest iran . forty 3 - 6-year - old children , diagnosed with oppositional defiant disorder comorbid with adhd , were randomized to an 8-week trial of treatment with risperidone or aripiprazole ( 20 patients in each group ) . assessment was performed by conners rating scale - revised and clinical global impressions scale , before treatment , and at weeks 2 , 4 , and 8 of treatment . the data were analyzed by spss version 16 . mean scores between the two groups were compared by analysis of variance and independent and paired t - test . mean scores of conners rating scales were not different between two groups in any steps of evaluation . both groups had significantly reduced scores in week 2 of treatment ( p = 0.00 ) , with no significant change in subsequent measurements . rates of improvement , mean increase in weight ( p = 0.894 ) , and mean change in fasting blood sugar ( p = 0.671 ) were not significantly different between two groups . mean serum prolactin showed a significant increase in risperidone group ( p = 0.00 ) . both risperidone and aripiprazole were equally effective in reducing symptoms of adhd and oppositional defiant disorder , and relatively safe , but high rates of side effects suggest the cautious use of these drugs in children .",1
"in this case report , we present the occlusion of multiple coronary artery fistulae originating from proximal left anterior descending ( lad ) and right sinus valsavla and empting to the pulmonary artery at the same place . we occluded lad fistulae by using thrombus aspiration catheter as a delivery guide . to the best of our knowlege , this is the first case of occlusion of coronary fistulae with the help of thrombus aspiration catheter . our experience may suggest that thrombus aspiration catheters can be used in treating coronary artery fistulae with difficult anotomy .",1
"Title: Novel GLP-1 Receptor Agonist ALV003 Exhibits Superior Efficacy in Clinical Trials for the Management of Obesity Compared to Liraglutide and Placebo. Background: Obesity has become a worldwide epidemic associated with increased morbidity and mortality. Despite advances in our understanding of the molecular mechanisms underlying obesity, current pharmacological interventions for obesity treatment are limited and have significant side effects. The novel peptide agonist, ALV003, is designed to selectively activate the glucagon-like peptide-1 (GLP-1) receptor, without activating the glucagon receptor.",0
"objective . evaluate the association between acculturation and binge drinking among six asian - american subgroups . methods . a cross - sectional analysis of public access adult portion of 2007 , 2009 , and 2011/2012 california health interview survey data was conducted . univariate and multivariable logistic regression analyses were utilized with any binge drinking in the past year as the outcome variable and language spoken at home and time in usa as proxy measures of acculturation . results . a total of 1,631 asian - americans ( n = 665,195 ) were identified as binge drinkers . binge drinking was positively associated with being first generation south asian ( or = 3.05 , 95% ci = 1.55 , 5.98 ) and monolingual ( english only ) vietnamese ( or = 3.00 ; 95% ci = 1.58 , 5.70 ) , especially among females . other factors associated with increased binge drinking were being female ( chinese only ) , not being current married ( south asian only ) , and being an ever smoker ( all subgroups except south asians ) . conclusion . first generation south asians and linguistically acculturated vietnamese , especially females , are at an increased risk of binge drinking . future studies and preventive measures should address the cultural basis of such health risk behaviors among asian - american adults .",1
"Background: Hepatocellular carcinoma (HCC) is the third most frequent cause of cancer related mortality worldwide. Although the exact cause of HCC remains unknown, chronic viral infections, primarily hepatitis B and hepatitis C are the most important factors contributing to its development. Understanding the molecular mechanisms associated with carcinogenesis of HCC has been a focus of intense research and gene expression profiling of HCC tissue has emerged as one such important strategy to further this understanding.",0
"gaucher disease is the most common lysosomal storage disease . it is caused by the defective activity of acid -glucosidase , which results in the accumulation of lipid glucocerebroside in macrophages throughout the body . in this case report we describe the case of a young adult woman with splenomegaly as the primary manifestation of this pathology . this is a case of type 1 gaucher disease because there is a lack of primary neurological involvement but we have , instead , an age - independent involvement of the visceral organs . it is very important to classify or characterize these patients in a precise manner and to make a complete diagnosis with the help of the many diagnostic resources now at our disposal , especially with genetics , radiology and new techniques of advanced microscopy , also because gaucher disease requires a long and complex management from early life to adulthood .",1
"Background: Hepatocellular carcinoma (HCC) is one of the most common malignant tumors worldwide, and the leading cause of cancer related mortality, especially in China. Despite improvements in therapeutic methods, the prognosis of patients with HCC remains poor. HCC is a multi-factorial disease of unknown etiology, with risk factors including, but not limited to: hepatitis B/C infection, exposure to aflatoxin B1, and alcohol consumption.",0
"background and aims:injuries due to lethal weapons has emerged as a subject of public discussion in sri lanka . this study was conducted to describe the nature and characteristics of injuries due to lethal weapons during civil strife and to compare those with injuries after civil strife.methods:a cross - sectional study was conducted on patients reported with injuries caused by lethal weapons from 2004 to 2014 . periods before and after may 19 , 2009 were considered as during and after civil strife periods , respectively . a total of 21,210 medico - legal examination forms were studied.results:there were 358 ( 1.7% ) injuries caused by lethal weapons . of them , 41% ( n = 148 ) were during and 59% ( n = 210 ) were after the civil strife . during civil strife , 63% occurred during daytime ( p < 0.05 ) . types of lethal weapons that caused injuries were sharp weapons ( n = 282 ) , explosives ( n = 49 ) , and firearms ( n = 27 ) . of them , 32% of during and 01% of after civil strife were explosive injuries ( p < 0.01 ) . regarding severity , 73% of during and 57% of after civil strife injuries were severe ( p < 0.05 ) . during civil strife , 34% injuries were in lower limbs ( p < 0.01 ) and after civil strife , 37% were in upper limbs ( p < 0.05).conclusions : the presence of many similarities indicated that both groups learnt their basis in a society that breeds violence . during civil strife , more injuries occurred during daytime , to lower limbs by explosive weapons and after the civil strife during nighttime , to upper limbs by nonexplosive weapons . nonexplosive lethal weapon use after civil strife needs further investigation to develop evidence - based interventions .",1
"Malignant melanoma is a cutaneous carcinoma with high rate of metastasis. Historically, the most effective treatment for patients with advanced disease was dacarbazine, which provided only a modest improvement in patient survival. In recent years, the treatment landscape for metastatic melanoma has changed dramatically with the development of a number of novel therapies targeting the programmed cell death-1 (PD-1)/programmed cell death ligand-1 (PD-L1) and cytotoxic T lymphocyte antigen-4 (CTLA-4) immune checkpoints. In this study, we evaluated the efficacy of nivolumab, a novel anti-PD-1 antibody, in a large cohort of patients with advanced melanoma. Nivolumab was highly effective, with an objective response rate of 50% and overall survival of 15 months. In multivariate analysis, tumor PD-L1 expression was associated with improved objective response and overall survival. Importantly, we also evaluated nivolumab in combination with ipilimumab, an anti-CTLA-4 antibody. We found that the combination",0
"backgroundthe aim of this study was to investigate the effects of intramuscular il-8 injection on hepatic tissues using an in vivo histopathological animal model.material/methodstwelve new zealand white rabbits were used for this randomized , controlled , single - blinded interventional study . for 6 days , 1 gluteus maximus muscle was injected daily with 1 mcg / kg of il-8 in 6 rabbits ( group a ) . the remaining 6 rabbits ( to determine to normal porto - hepatic morphology of the rabbit genus ) were in the sham group ( group b ) . at the end of the 7th day , all rabbits were killed and livers were meticulously harvested . microscopically , regional tissues were scored according to portal inflammation , focal necrosis , piecemeal necrosis , and total impact.resultstotal impact score , portal inflammation , focal necrosis , and piecemeal necrosis were the histopathologic changes present in a higher incidence in the il-8 group compared with the control group . the differences were significant when the groups were compared according to total impact score , portal inflammation , focal necrosis , and piecemeal necrosis according to pearson s correlation ( p<0.05 ) . the most significant differences were detected at the total impact scores ( p=0.002 ) and the portal inflammation scores ( p=0.008).conclusionsour results showed that il-8 may damage hepatocytes . this can be the determined target for new therapeutic strategies . further trials should be designed to obtain definitive results .",1
"hemipelvic resections for primary bone tumours require reconstruction to restore weight bearing along anatomic axes . however , reconstruction of the pelvic arch remains a major surgical challenge because of the high rate of associated complications . we used the pedicle screw - rod system to reconstruct the pelvis , and the purpose of this investigation was to assess the oncology , functional outcome and complication rate following this procedure . the purpose of this study was to investigate the operative indications and technique of the pedicle screw - rod system in reconstruction of the stability of the sacroiliac joint after resection of sacroiliac joint tumours . the average msts ( musculoskeletal tumour society ) score was 26.5 at either three months after surgery or at the latest follow - up . seven patients had surgery - related complications , including wound dehiscence in one , infection in two , local necrosis in four ( including infection in two ) , sciatic nerve palsy in one and pubic symphysis subluxation in one . there was no screw loosening or deep vein thrombosis occurring in this series . using a pedicle screw - rod after resection of a sacroiliac joint tumour is an acceptable method of pelvic reconstruction because of its reduced risk of complications and satisfactory functional outcome , as well as its feasibility of reconstruction for type iv pelvis tumour resection without elaborate preoperative customisation.level of evidence : level iv , therapeutic study .",1
"Background: Metastatic melanoma is a major health problem with limited treatment options. It has a high tendency to spread to other organs, leading to poor prognosis and high mortality. Current treatments for metastatic melanoma, including chemotherapy, targeted therapy, and radiation therapy, have limited efficacy. Therefore, developing new and effective treatments for metastatic melanoma is crucial.",0
"in postmenopausal women presenting with virilization and elevated testosterone levels , laparoscopic salpingo - oophorectomy should be considered after exclusion of adrenal causes . a clinicopathological study was conducted among those women who presented with features of hyperandrogenism in our postmenopausal clinic over a period of 2 years . relevant past medical and surgical histories were elicited . basic hormonal evaluation and radiological imaging were done . laparoscopic bilateral salpingo - oophorectomy was done . six weeks postoperatively , serum testosterone was undetectable with significant clinical improvement . there was no recurrence of symptoms during the follow - up period of 2 years . treatment of postmenopausal women with hyperandrogenism and virilization with laparoscopic bilateral salpingo - oophorectomy is effective if she has no pronounced ovarian enlargement or adrenal tumor on imaging . an extensive endocrine testing and a detailed search for metastatic disease may be unnecessary .",1
"Triple-negative breast cancer (TNBC) has limited therapeutic options and poor prognosis. The search for targetable mutations in TNBC has led to the discovery of several recurrent mutations, including mutations in the BRCA genes. The gold standard for BRCA testing is a DNA sequencing method known as direct genetic testing. This method is expensive and can be challenging to obtain. Alternative methods, such as immunohistochemistry (IHC) and polymerase chain reaction (PCR), have been developed as cheaper and more convenient alternatives. However, these methods have been inconsistent in their results and may not be able to detect all BRCA mutations. In this study, we analyzed 100 TNBC samples using direct genetic testing and compared the results to those obtained from IHC and PCR. We found that direct genetic testing detected BRCA mutations in 20% of the TNBC samples, while IHC and PCR detected BRCA mutations in only 12% and 9% of the TNBC samples, respectively. Our study suggests that direct genetic testing is the best method for detecting BRCA mutations in TNBC and should be",0
