text,label
"introduction . simultaneous resection of primary colorectal carcinoma ( crc ) and synchronous liver metastases ( slms ) is subject of debate with respect to morbidity in comparison to staged resection . the aim of this study was to evaluate our initial experience with this approach . methods . five patients with primary crc and a clinical diagnosis of slm underwent combined laparoscopic colorectal and liver surgery . patient and tumor characteristics , operative variables , and postoperative outcomes were evaluated retrospectively . results . the primary tumor was located in the colon in two patients and in the rectum in three patients . the slm was solitary in four patients and multiple in the remaining patient . surgical approach was total laparoscopic ( 2 patients ) or hand - assisted laparoscopic ( 3 patients ) . the midline umbilical or transverse suprapubic incision created for the hand port and/or extraction of the specimen varied between 5 and 10 cm . median operation time was 303 ( range 151384 ) minutes with a total blood loss of 700 ( range 200850 ) ml . postoperative hospital stay was 5 , 5 , 9 , 14 , and 30 days . an r0 resection was achieved in all patients . conclusions . from this initial single - center experience , simultaneous laparoscopic colorectal and liver resection appears to be feasible in selected patients with crc and slm , with satisfying short - term results .",1
"Title: Evaluation of urinary biomarkers for early detection of chronic kidney disease progression. Background: The early detection and prediction of chronic kidney disease (CKD) progression is crucial for initiating timely treatment. Current methods for assessing renal function rely on serum creatinine, which lacks sensitivity in the early stages of CKD. Therefore, there is a need to identify novel biomarkers for predicting CKD progression.",0
"introduction : the increasing availability of robotic devices has led to an increase in their use for procedures such as pyeloplasty , which have been conventionally performed laparoscopically or through open surgery . we perform both laparoscopic and robotic - assisted pyeloplasty routinely and have compared these techniques in a set of concurrent cohorts , operated by the same surgeon.materials and methods : a chart review was performed of all cases of robot - assisted laparoscopic pyeloplasty ( ralp ) and conventional laparoscopic pyeloplasty ( clp ) performed by a single surgeon , from september 2006 to july 2010 . the choice of procedure depended upon the availability of the robot on the given day . a lateral transperitoneal approach was used in all cases . all anastomoses were stented antegrade . a diuretic renogram was obtained in all patients between six to twelve weeks after stent removal . success was defined as a resolution of symptoms with non - obstructive outflow on the renogram.results:thirty patients underwent 31 laparoscopic pyeloplasties ( 20 ralps and 11 clps ) , with one patient undergoing bilateral simultaneous robotic procedures . the robotic procedures were superior in terms of shorter operating time by 20 minutes on an average . furthermore , 35% of the robotic procedures were performed in under 90 minutes , while the minimum time taken for laparoscopy was 110 minutes . all procedures in both cohorts were successful with no complications in either group . the surgeon recorded subjective ergonomic benefits with the use of the robot.conclusions:robotic assistance helps decrease the operative time for laparoscopic pyeloplasty . it seems ergonomically superior for the surgeon , allowing multiple procedures in the same list . these may be important benefits in busy centers .",1
"Due to the global pandemic, the need for efficient cardiovascular risk reduction strategies has become more important than ever. Aim of this study is to evaluate the effects of statins in primary prevention of cardiovascular diseases. In the current study, a population of individuals without a history of cardiovascular diseases was followed. The effect of statins on cardiovascular outcomes and adverse events was studied.",0
"an 8-year - old male patient who had been diagnosed as acute lymphoblastic leukemia ( all ) 4 years ago and received 120 cures of chemotherapy presented at our clinic complaining of spots on his body 3 months after the end of chemotherapy . anamnesis of the patient revealed that the lesions started 3 months after the last cure of chemotherapy on the abdomen and spread throughout the body . it was learnt that the number of spots increased very rapidly in a period of 2 months , and exceeded 100 . a dermatological examination of the patient showed 142 hyperpigmented macules , the largest of which was 1 cm 1 cm and the smallest was 0.2 cm 0.2 cm in size , diffusely scattered to the skin and oral mucosa . when the biopsy material taken from the lesions was histopathologically examined , nest structures composed of nevus cells with oval nuclei and eosinophilic cytoplasm starting from the dermoepidermal junction and extending toward the lower epidermis were observed and found to be consistent with the compound nevus . we present this rare case who was diagnosed as eruptive compound nevus on the basis of clinical signs , all diagnosis , chemotherapy history and histopathologic evaluation .",1
"In humans, telomere length has been associated with age-related health outcomes. Herein, we examined the relationship between telomere length and cellular senescence in vivo using telomere staining and fluorescence-activated cell sorting (FACS) analysis of peripheral blood mononuclear cells (PBMCs). We found that short telomeres were associated with higher levels of cellular senescence, and this association was independent of age, sex, race, and smoking status. Furthermore, we found that senescent cells have shorter telomeres than their proliferating counterparts. Together, these findings suggest that telomere length may be a biomarker for cellular senescence, and that cellular senescence may be a therapeutic target for age-related diseases.",0
"this is a review of teaching and learning stem : a practical guide , which goes beyond active - learning techniques into the realms of course design , facilitating skill development , and assessment . this superb resource compiles a plethora of empirical evidence , while unpacking it in a way that is immediately accessible to educators across disciplines .",1
"backgroundthe purpose of this study was to compare the shear bond strengths of two color - change adhesives with a commonly used conventional light - cure adhesive while using a self - etching primer , and to compare any changes in shear bond strengths over time.methodsone hundred and eighty extracted bovine incisors were randomly divided into nine groups of 20 teeth each . the teeth were prepared with a self - etching primer ( transbond plus ) metal lower incisor brackets were bonded directly to each tooth with two different color - change adhesives ( transbondplus and grngloo ) and a control ( transbond xt ) . the teeth were debonded at three different time points ( 15 minutes , 24 hours , 1 week ) using an instron at 1.0 mm / min . the teeth that were to be debonded at 24 hours and 1 week were stored in distilled water at 37c to simulate the oral environment . the data were analyzed by two - way analysis of variance and with fisher s protected least - significant difference multiple comparisons test at the p 80% samples presenting with an ari score of 1 at all times . interestingly , both transbond groups had ari scores of 3 in more than 50% of their samples.conclusiontime had no significant effect on the mean shear bond strength of transbond xt , grngloo , or transbond plus adhesive .",1
"background : nonoccupational anthracosis and silicosis has been reported from various parts of the world including ladakh in jammu and kashmir , india ; however , anthracosilicosis has only been reported in industrial workers till date.materials and methods : six cases from the ladakh region in jammu and kashmir , india with similar clinico - radiological - pathological features , i.e. , anthracosilicosis / anthracofibrosis have been analyzed . of these , four were analyzed retrospectively and two prospectively.result:all the patients were homemakers and resided in ladakh in jammu and kashmir , india since birth with an age range of 4262 years and an average age of 56 years . their average duration of symptoms was 4 years . spirometry showed small and/or large airway disease in 5/6 cases . on computed tomography ( ct ) , 4/6 cases showed progressive massive fibrosis ( pmf ) with calcified mediastinal lymph nodes . there were random or centrilobular nodules in all the six cases . bronchoscopy in 5/6 cases showed multiple anthracotic pigments with narrowing and distortion of the bronchus ( anthracofibrosis ) . malignancy was suspected clinico - radiologically in four cases and pathologically in two cases . on histopathology , anthracosis was demonstrated in all and silicosis in three cases.conclusion:anthracosilicosis can occur due to environmental exposure . ladakh in jammu and kashmir , india is the only place across the globe with unique environmental features having the presence of both free silica and biomass fuel . the disease was observed predominantly in older women . awareness would prevent unnecessary investigation for malignancy . treatment with the bronchodilator is useful as it has evidence of airway disease . finally , environmental measures and a proper study need to be undertaken for knowing the relative role of silica versus soot in causing the lung disease and preventing this irreversible condition .",1
"Chronic kidney disease (CKD) is a worldwide health problem and progression of CKD leads to development of end-stage renal disease. The progression of CKD is associated with the development of complications such as heart diseases and mortality. It is, therefore, crucial to identify CKD progression early to decrease the burden of disease. In this study, we investigated the association between renal biomarkers and CKD progression. In total, we recruited 404 participants from CKD outpatient clinics and followed them up for 3 years. Baseline renal biomarkers (serum cystatin C, urine N-acetyl-b-glucosaminidase and urine liver-type fatty acid binding protein) were measured using commercial enzyme-linked immunosorbent assay kits. CKD progression was defined as the development of end-stage renal disease or doubling of serum creatinine levels. After 3 years of follow-up, 104 (25.7%) participants progressed to end-stage renal disease or had doubling of serum creatinine",0
"purpose : the aim of this study is to evaluate whether two 3.0 mm schanz screws in two - part proximal humeral fractures ( plus one additional schanz screw or k wire in three - part fractures ) can provide enough stability to allow early mobilization until healing occurs in elderly patients.settings and design : this prospective study was performed in the orthopaedic department of our university hospital.patients and methods : we performed closed reduction and percutaneous pinning for thirty - three patients with proximal humerus fractures . twenty - seven patients were available for the final follow - up . of those 27 patients , 17 had two - part surgical neck fractures ; while 10 had three - part fractures . for fixation , we used two 3.0 mm schanz screws in patients with two - part fractures plus one additional schanz screw or k wire in the 10 patients with three - part fractures.results:the mean constant score modified according to the age and sex was 89.8% ( range : 77.3 - 97.2% ) . fifteen patients had excellent results , 11 patients had good results , and one patient had a fair result.conclusion:closed reduction and percutaneous pinning with two schanz screws for two - part surgical neck humeral fractures , plus an additional schanz screw or k wire for three - part proximal humeral fractures is a useful and effective technique that provides enough stability to allow an early rehabilitation program till union occurs in elderly patients.level of evidence : iv ; therapeutic study , case series .",1
"introduction and aims : diabetes is one of the chronic and prevalent diseases in the world . diabetic patients number has increased 7 times during last 20 years . if this current situation continues , diabetic patients population will be 350 millions ones in 2030 . it means that 7 millions people will be added annually . up to now , different uncontrollable factors have been monitored in self - caring of this disease for managing and preventing from its early and late side effects . this research is conducted to study the role of self - efficacy as a determinant agent in self - caring of diabetic patients.study method : this is a narrative review study in which various information banks and search motors such as pubmed , proquest , scopus , elsevier were reviewed . diabetes , self - care and self efficacy keywords from cross sectional , cohort , clinical experimental studies and systematic review were also used in the study construction . iranian banks such as iranmedex , medline and also different articles from domestic research and scientific magazines were selected . time spectrum of reviewed studies was supposed to be published from 1990 up to 2011.results:self-care situation among diabetic patients not only is unsatisfactory but also the studies results show that self - efficacy rate is low among them . the findings of the studies prove that there is a direct relation between self - efficacy and self - care in the patients in a way that this construct owns the predictability power of self - care behavior.conclusion:self-caring has a significant role in controlling of diabetes disease . self - efficacy can induce motivation directly take health promoting behavior through efficacy expectations . it also affects motivation , indirectly , through perceived barriers and determining commitment or stability for following function map . so , self - efficacy is very important in changing self - care behavior process .",1
"Background: Hepatocellular carcinoma (HCC) is the most common primary liver cancer and the fifth most common cancer worldwide. The most critical step in the treatment of HCC is early diagnosis. Therefore, it is necessary to identify new and sensitive biomarkers for early detection.",0
"purposeto investigate the heart rate ( hr ) and its autonomic modulation at baseline and during dynamic postexercise ( pex ) with intensities of 40% and 60% of the maximum hr in healthy elderly.methodsthis cross - sectional study included ten apparently healthy people who had been submitted to a protocol on a cycle ergometer for 35 minutes . autonomic modulation was evaluated by spectral analysis of hr variability ( hrv).resultsa relevant increase in hr response was observed at 15 minutes postexercise with intensities of 60% and 40% of the maximum hr ( 102 bpm versus 51 bpm , respectively ; p=0.005 ) , and a significant reduction in hrv was also noted with 40% and 60% intensities during the rest period , and significant reduction in hrv ( rr variance ) was also observed in 40% and 60% intensities when compared to the baseline , as well as between the post - exercise intensities ( 103232 ms versus 9055 ms ) ( p<0.001 ) . in the hrv spectral analysis , a significant increase in the low frequency component hrv and autonomic balance at 40% of the maximum hr ( 682 normalized units [ nu ] versus 551 nu and 2.00.1 versus 1.20.1 ; p<0.001 ) and at 60% of the maximum hr ( 771 nu versus 551 nu and 3.20.1 versus 1.20.1 [ p<0.001 ] ) in relation to baseline was observed . a significant reduction of high frequency component at 40% and 60% intensities , however , was observed when compared to baseline ( 312 nu and 231 nu versus 451 nu , respectively ; p<0.001 ) . moreover , significant differences were observed for the low frequency and high frequency components , as well as for the sympathovagal balance between participants who reached 40% and 60% of the maximum hr.conclusionthere was an increase in the hr , sympathetic modulation , and sympathovagal balance , as well as a reduction in vagal modulation in the elderly at both intensities of the pex .",1
"Recent studies have demonstrated the importance of gut microbiome composition in the pathogenesis of inflammatory bowel disease (IBD). Our study utilized shotgun metagenomic sequencing to investigate the differences in microbial community composition between healthy controls and patients with IBD. We recruited 20 participants with Crohn's disease, 20 with ulcerative colitis, and 20 healthy controls, and performed shotgun metagenomic sequencing of their fecal samples. We used the HUMAnN pipeline to analyze the resulting sequence reads and determined the abundance of taxa at the genus level. Our results showed a significantly reduced abundance of Prevotella in patients with Crohn's disease compared to healthy controls. We also found an increased abundance of Faecalibacterium in patients with ulcerative colitis compared to healthy controls. Our findings suggest that gut microbiome composition plays a crucial role in the pathogenesis of IBD, and further research is needed to identify specific microbes that could serve as therapeutic targets for this disease.",0
"Background: Sickle cell disease (SCD) is a genetic blood disorder characterized by red blood cells (RBCs) with an abnormal crescent shape. These abnormal RBCs can obstruct blood flow, leading to pain crises and organ damage. Current treatments are limited and often ineffective.",0
"purpose . to assess fgf- , tgf- , and cox2 expression and immunocompetent cells in the orbital tissue of patients with severe and mild graves ' orbitopathy . patients and methods . orbital tissue was taken from 27 patients with go : ( 1 ) severe go ( n = 18 ) , the mean clinical activity score ( cas ) being 8.5 ( sd 2.5 ) ; and ( 2 ) mild go ( n = 9 ) , the mean cas being 2.2 ( sd 0.8 ) , and from 10 individuals undergoing blepharoplasty . the expression of cd4 + , cd8 + , cd20 + , and cd68 and fgf- , tgf- , and cox2 in the orbital tissue was evaluated by immunohistochemical methods . results . we demonstrated predominant cd4 + t cells in severe go . cd68 expression was observed in the fibrous connective area of mild go and was robust in severe go , while the prominent tgf- expression was seen in all go . increased fgf- expression was observed in the fibroblasts and adipocytes of severe go . no expression of cox2 was found in patients with go . conclusions . macrophages and cd4 t lymphocytes are both engaged in the active / severe and long stage of inflammation in the orbital tissue . fgf- and tgf- expression may contribute to tissue remodeling , fibrosis , and perpetuation of inflammation in the orbital tissue of go especially in severe go .",1
"Background: Long-COVID is a constellation of symptoms associated with SARS-CoV-2 infection. The pathophysiology of long-COVID is poorly understood, and there are no specific treatments available. Spike protein is a structural protein present on the surface of the SARS-CoV-2 virus that binds to host cell receptors, enabling viral entry. The spike protein has been implicated in the development of long-COVID symptoms.",0
"background : growth factors play an essential role in the development of tumor and normal cells like testicular leydig cells . treatment of cancer with anti - cancer agents like imatinib mesylate may interfere with normal leydig cell activity , growth and fertility through failure in growth factors production or their signaling pathways . the purpose of the study was to determine cellular viability and the levels of , platelet derived growth factor ( pdgf ) and stem cell factor ( scf ) in normal mouse leydig cells exposed to imatinib , and addressing the effect of imatinib on fertility potential.methods:the mouse tm3 leydig cells were treated with 0 ( control ) , 2.5 , 5 , 10 and 20 m imatinib for 2 , 4 and 6 days . each experiment was repeated three times ( 15 experiments in each day).the cellular viability and growth factors levels were assessed by mtt and elisa methods , respectively . for statistical analysis , one - way anova with tukey s post hoc and kruskal - wallis test were performed . a p - value less than 0.05 was considered statistically significant.results:with increasing drug concentration , cellular viability decreased significantly ( p<0.05 ) and in contrast , pdgf levels increased ( p<0.05 ) . different imatinib concentrations had no significant effect on scf level . increasing the duration of treatment from 2 to 6 days had no obvious effect on cellular viability , pdgf and scf levels.conclusion:imatinib may reduce fertility potential especially at higher concentrations in patients treated with this drug by decreasing cellular viability . the effect of imatinib on leydig cells is associated with pdgf stimulation . of course future studies can be helpful in exploring the long term effects of this drug .",1
"GLP-1 receptor agonists have been extensively used for the management of diabetes. However, given the increasing prevalence of obesity, GLP-1 receptor agonists have emerged as a potential tool for weight loss due to their superior efficacy and tolerability profiles. We conducted a systematic review of randomized controlled trials evaluating the efficacy and safety of GLP-1 receptor agonists for weight loss management. A total of 30 trials involving 8,464 patients were included in the analysis. All trials showed that GLP-1 receptor agonists led to significant weight loss compared to placebo, with an overall mean difference in weight change of -4.2 kg (-5.0 kg to -3.4 kg; P < 0.00001). Moreover, GLP-1 receptor agonists were associated with significant reductions in BMI, waist circumference, and body fat percentage. Adverse events reported in GLP-1 receptor agonist-treated patients were mostly mild to moderate and occurred at similar frequencies to placebo. Thus, GLP-1 receptor agonists can be used as a safe and",0
"Background: Inflammatory bowel disease (IBD) is a chronic inflammatory condition of the gastrointestinal tract with increasing prevalence worldwide. Dysbiosis of the gut microbiota is associated with the development of IBD, but the specific microbiota involved in the pathogenesis of IBD remains unknown.",0
"the optical properties of molecules close to plasmonic nanostructures greatly differ from their isolated molecule counterparts . to theoretically investigate such systems from a quantum - chemistry perspective , one has to take into account that the plasmonic nanostructure ( e.g. , a metal nanoparticle np ) is often too large to be treated atomistically . therefore , a multiscale description , where the molecule is treated by an ab initio approach and the metal np by a lower level description , is needed . here we present an extension of one such multiscale model [ corni , s. ; tomasi , j. j. chem . phys.2001 , 114 , 3739 ] , originally inspired by the polarizable continuum model , to a real - time description of the electronic dynamics of the molecule and of the np . in particular , we adopt a time - dependent configuration interaction ( td ci ) approach for the molecule , the metal np is described as a continuous dielectric of complex shape characterized by a drude lorentz dielectric function , and the molecule np electromagnetic coupling is treated by an equation - of - motion ( eom ) extension of the quasi - static boundary element method ( bem ) . the model includes the effects of both the mutual molecule np time - dependent polarization and the modification of the probing electromagnetic field due to the plasmonic resonances of the np . finally , such an approach is applied to the investigation of the light absorption of a model chromophore , licn , in the presence of a metal np of complex shape .",1
"kindock is a new web server for the analysis of atp - binding sites of protein kinases . this characterization is based on the docking of ligands already co - crystallized with other protein kinases . a structural library of protein kinase ligand complexes has been extracted from the protein data bank ( pdb ) . this library can provide both potential ligands and their putative binding orientation for a given protein kinase . after protein protein structural superposition , the ligands are transferred from the template complexes to the target protein kinase . the resulting complexes are evaluated using the program score to compute a theoretical affinity . they can be dynamically visualized to allow a rapid mapping of important steric clashes and potential substitutions relevant for specificity and affinity . these characteristics allow a quick characterization of protein kinase active sites including conformation changes potentially required to accommodate particular ligands . additionally , promising pharmacophores can be identified in the focussed library . these features will help to rationalize or optimize virtual screening ( vs ) on larger chemical compound libraries . the server and its documentation are freely available at .",1
