text,label
"Background: Frontotemporal dementia (FTD) is a progressive neurodegenerative disease that affects the frontal and temporal lobes of the brain. The hallmark pathology of FTD is the accumulation of tau protein aggregates, which can cause microtubule disruption and synaptic failure. In this study, we investigate the effects of tau protein aggregation on synaptic plasticity in FTD.",0
"Metformin is a widely-used and cost-effective oral antidiabetic medication that reduces insulin resistance through the activation of AMPK, a cellular energy sensor. In addition to its glucose-lowering properties, there is growing evidence that metformin may also have a role in cancer prevention. However, metformin therapy does not lead to complete normalization of blood glucose levels in many patients with type 2 diabetes. The purpose of this study was to evaluate the effects of metformin as an adjunct therapy in type 2 diabetic patients receiving insulin and/or other antidiabetic agents.",0
"Sickle cell disease (SCD) is a prevalent genetic blood disorder with a high global disease burden that lacks effective treatment. Current treatment is limited to symptom management and curative stem cell transplantation, which is restricted by donor availability and risks of morbidity and mortality.",0
"Title: A novel IL-6 signaling pathway underlying synovial inflammation in rheumatoid arthritis. Abstract: Rheumatoid arthritis (RA) is a chronic inflammatory disease affecting over 1 million adults in the US alone. The synovium of RA patients is characterized by infiltration of immune cells and excessive production of proinflammatory cytokines, particularly interleukin-6 (IL-6). Currently available therapies, which include disease-modifying anti-rheumatic drugs and monoclonal antibodies targeting IL-6, do not effectively treat all RA patients. Thus, a better understanding of the molecular mechanisms underlying RA is needed to develop more effective treatments. In this study, we identified a novel signaling pathway that regulates the production of proinflammatory cytokines in RA synovial fibroblasts. Using mass spectrometry, we identified the kinase TTK as a highly upregulated kinase in RA synovial tissue and fibroblasts. We demonstrated that TTK inhibition in RA synovial fibro",0
"a new technique is used to study a family of time - dependent null horizons , called evolving null horizons ( enhs ) , of generalized robertson - walker ( grw ) space - time ( m,g ) such that the metric g satisfies a kinematic condition . this work is different from our early papers on the same issue where we used ( 1 + n)-splitting space - time but only some special subcases of grw space - time have this formalism . also , in contrast to previous work , we have proved that each member of enhs is totally umbilical in ( m,g ) . finally , we show that there exists an enh which is always a null horizon evolving into a black hole event horizon and suggest some open problems .",1
"there are some important prognostic factors for papillary thyroid carcinoma ( ptc ) and follicular thyroid carcinoma ( ftc ) . in this paper , clinicopathological features significantly affecting patient prognosis are described based on our data as well as others . distant metastasis at diagnosis is the most important prognostic factor for both ptc and ftc . other than that , preoperative and intraoperative findings are important to evaluate the biological behavior of ptc . extrathyroid extension , large lymph - node metastasis , and extranodal tumor extension that can be evaluated preoperatively or intraoperatively are significant prognostic factors for ptc patients . in contrast , pathological findings are important not only for diagnosis of ftc , but also for the evaluation of its biological character . grade of invasiveness ( minimally or widely invasive ) and degree of differentiation ( well differentiated or including a poorly differentiated component ) greatly affect the prognosis of ftc patients .",1
"Background: Alzheimer’s disease (AD) is a neurodegenerative disorder that affects over 5 million people worldwide, and is characterized by extracellular Aβ plaques and intracellular NFTs composed of hyperphosphorylated tau. However, the mechanisms underlying tau aggregation remain unclear. Genetic and biochemical approaches have been used to model tauopathies in vitro; however, these approaches often fail to replicate the complex cellular environment. Thus, in this study we used a human neuronal model of tauopathy that was developed in vivo and is derived from induced pluripotent stem cells (iPSCs) of a FTD patient harboring the R406W MAPT mutation (M1153T).",0
"purposeto evaluate the factors affecting the bone union time and the occurrence of nonunion after intramedullary nailing of subtrochanteric femoral fractures in adults.materials and methodswe retrospectively reviewed data from 31 patients ( 22 men and 9 women ) who had undergone femoral intramedullary nailing at least 1 year post - operatively and analyzed the bone union time , nonunion rates , and factors that affected the bone union time according to the fracture classification ( ao and fielding classifications ) , comminution of the medial cortex , reduction method , and additional cerclage wiring.resultsthe average union time was 26.4 weeks . there were no differences in the bone union time according to the fracture classification , reduction method , or additional cerclage wiring . significant differences were found in the bone union time between the medial cortex comminution and non - comminution groups . a relatively strong positive correlation was detected between the degree of post - operative displacement and the bone union time . nonunion occurred in three cases and there was no failure of implants.conclusionthe bone union time was not affected by the reduction method nor additional cerclage wiring in intramedullary nailing of subtrochanteric femur fractures . comminution of the medial cortex and the degree of the postoperative displacement of fractures contributed to the delayed time of union .",1
"Background: Frontotemporal dementia (FTD) is an age-related neurodegenerative disorder characterized by cognitive deficits and behavioral abnormalities. Accumulation of tau protein, microtubule-associated protein, has been identified as a histopathological hallmark of FTD. The main pathological characteristics of FTD are tau aggregations and the loss of cortical neurons and synapses. Several mechanisms, including neuroinflammation, oxidative stress, and protein misfolding, have been implicated in the pathogenesis of FTD. However, the precise mechanisms of tau aggregation in FTD remain largely unknown.",0
"nuclear receptors play an important role in transcriptional regulation of diverse cellular processes and is also relevant in diseases such as cancer . in breast cancer , the nuclear receptors estrogen receptor ( er ) and progesterone receptor ( pr ) are classical markers of the disease and are used to classify breast cancer subtypes . using a recently developed affinity purification ms technique ( rime ) [ 1 ] , we investigate the protein interactors of er and pr in breast cancer cell lines upon stimulation by the ligands estrogen and progesterone . the data is deposited at proteomexchange ( pxd002104 ) and is part of a publication [ 2 ] that explains the link between the two nuclear receptors and potential consequences of this in breast cancer . in this manuscript , we describe the methodology used and provide details on experimental procedures , analysis methods and analysis of raw data . the purpose of this article is to enable reproducibility of the data and provide technical recommendations on performing rime in hormonal contexts .",1
"objectives : to evaluate the effect of spreader size on apical leakage of maxillary incisor teeth.materials and methods : a total of 75 permanent human teeth with no carious and no fracture or crack were used for this study . after removing the crown from the cementoenamel junction and the standardization of the root lengths , the specimens were randomly divided into five groups : group 1 - roots were not instrumented . group 2 - root canals were enlarged using the step - back technique to a # 40 file and filled using cold lateral compaction ( clc ) of gutta - percha ( gp ) . group 3 - during the filling procedure , the first spreader used was size 40 . group 4 - the first spreader used was size 35 . group 5 - the initial spreader used was size 25 . the amount of leakage through the filled root canals was evaluated by computerized fluid filtration model . statistical analyzes were done using kruskal wallis test and mann whitney test ( p < 0.05).results : there were statistically significant differences among the groups ( p < 0.05 ) . while the uninstrumented group ( group 1 ) had no leakage , instrumented but not filled roots ( group 2 ) demonstrated the highest leakage values . there were no differences between group 3 and 4 . group 5 showed significantly less leakage than group 3 and 4.conclusion:spreader size used during clc of gp appeared to be a significant factor on apical leakage of roots . using smaller size spreader during clc may provide relatively less leakage .",1
"The prevalence of obesity is increasing rapidly worldwide, despite significant efforts to reduce it. GLP-1 receptor agonists are effective for the treatment of type 2 diabetes, but their efficacy in treating obesity has not been fully explored. In this study, we investigated the effects of GLP-1 receptor agonists on obesity in a double-blind, randomized, placebo-controlled trial.",0
"granulosa cell tumours of the ovary are rare , comprising around 3% of ovarian tumours . these tumours have preponderance for local spread and extremely late recurrence . although previous cases of recurrence have been described , it is extremely unusual for these tumours to recur after thirty years . we describe a case of recurrence of granulosa cell tumour after 30 years , presenting as small bowel obstruction . the patient had not been followed up after the original surgery , and on histological analysis , recurrence of the original tumour was confirmed . this case report emphasises the necessity for lifelong follow - up of patients who have had these tumours excised , and also the unusual way in which these tumours can recur .",1
"In this double-blind, randomized clinical trial, 170 participants with a BMI ≥ 30 kg/m2 were administered subcutaneous doses of liraglutide or a placebo (p.o.) for 12 weeks. Baseline fasting glucose levels were similar between groups (p > .05). At study completion, treatment with liraglutide significantly reduced (p < .001) fasting glucose (−5.2 ± 1.6 mg/dL) compared to the control group. In addition, HbA1C was significantly lower (p < .001) in the liraglutide group (−0.2 ± 0.1%) compared to the control group. Liraglutide also reduced (p < .001) fasting insulin (−8.2 ± 1.6 mIU/L) and homeostatic model assessment of insulin resistance (−22.3 ± 7.8%) compared to the control group. Furthermore, total cholesterol (−26.7 ± 17.3 mg",0
"background : aminoglycosides are commonly used antibiotics in the intensive care unit ( icu ) , but are associated with nephrotoxicity . this study evaluated the development of aminoglycoside - associated nephrotoxicity ( aan ) in a single surgical intensive care unit.materials and methods : adult patients in our surgical icu who received more than two doses of aminoglycosides were retrospectively reviewed for demographics , serum creatinine , receipt of nephrotoxins [ angiotensin converting enzyme ( ace ) inhibitors , angiotensin - ii receptor blockers , diuretics , non - steroidal anti - inflammatory drugs , cyclosporine , tacrolimus , vasopressors , vancomycin and intravenous iodinated contrast ] and the need for dialysis . aan was defined as an increase in serum creatinine > 0.5 mg / dl on at least 2 consecutive days . univariate and multiple regression analyses were performed.results:sixty-one patients ( 43 males ) receiving aminoglycoside were evaluated . mean age , weight , initial serum creatinine , and duration of aminoglycoside therapy were 58.7 ( 15 ) years , 83.3 ( 24.4 ) kg , 0.9 ( 0.5 ) mg / dl , and 4 ( 2.3 ) days , respectively . thirty - one ( 51% ) aminoglycoside recipients also received additional nephrotoxins . seven aminoglycoside recipients ( 11.5% ) developed aan , four of whom required dialysis and all had received additional nephrotoxins . only concurrent use of vasopressors ( p = 0.041 ) and vancomycin ( p = 0.002 ) were statistically associated with aan . receipt of vasopressors or vancomycin were independent predictors of acute kidney insufficiency ( aki ) with odds ratios of 19.9 ( 95% ci : 1.6245 , p = 0.019 ) and 49.8 ( 95% ci : 4.1602 , p = 0.002 ) , respectively . four patients ( 6.6% ) required dialysis.conclusions:in critically ill surgical patients receiving aminoglycosides , aan occurred in 11.5% of the patients . concurrent use of aminoglycosides with other nephrotoxins increased the risk of aan .",1
"Objective: To identify non-invasive biomarkers for early-stage Alzheimer disease (AD). Background: Alzheimer disease is a progressive neurodegenerative disorder that affects millions of people worldwide. Unfortunately, current diagnostic methods are expensive and do not detect the disease in its early stages. The goal of this study was to identify non-invasive biomarkers that can be used for early-stage AD detection. Methods: We collected samples from patients with early-stage AD and healthy controls. We then used advanced genomic techniques to identify potential biomarkers. Results: Our analysis identified a set of biomarkers that are significantly correlated with early-stage AD. These biomarkers include gene expression signatures, changes in epigenetic markers, and microRNA profiles. Conclusion: Our findings demonstrate the potential of non-invasive biomarkers for early-stage AD detection. These biomarkers may be used to develop a simple blood test that can detect Alzheimer disease in its early stages.",0
"[ purpose ] this study was conducted to investigate ultrasonically determined changes in the thickness of the transversus abdominis and internal oblique muscles during different sitting conditions . [ subjects and methods ] twenty healthy men volunteered to participate in this study . four different sitting conditions including ( a ) sitting , ( b ) sitting with left hip flexion , ( c ) sitting with an abdominal hollowing maneuver ( ahm ) , and ( d ) sitting with an ahm and left hip flexion , were used . subjective exercise difficulty was evaluated . [ results ] transversus abdominis and internal oblique muscle thicknesses significantly differed between conditions , with significantly greater thickness between positions from ( a ) to ( d ) . stability of the surface when sitting had no effect on the muscle thickness of the transversus abdominis . by contrast , sitting on an unstable surface caused an increase in muscle thickness of the internal oblique in each condition . the subjects reported progressively increasing difficulty in performing each exercise in a stable position from ( a ) to ( d ) , while the difficulty in an unstable position was significantly different between ( a ) and ( b ) , and between ( c ) and ( d ) . [ conclusion ] our findings suggest that task ( b ) on a stable surface should be chosen for maximal activation of transversus abdominis without inducing overactivation of the internal oblique muscle .",1
"background . catheter - related infections , thrombosis , and stenosis are among the most frequent complications associated with catheters , which are inserted in vessels . surface treatment processes of the outer surface , such as ion - beam - assisted deposition , can be used to mitigate such complications . methods . this retrospective study ( 19922007 ) evaluated silver - coated ( 54 patients ) and noncoated ( 105 patients ) implanted large - bore catheters used for extracorporeal detoxification . the catheters were inserted into the internal jugular or subclavian veins . after removal , the catheters were cultured for bacterial colonization using standard microbiologic assays . they also were examined using scanning electron microscope . results . the silver coated catheters showed a tendency towards longer in situ time . the microbiologic examinations of the catheter tips were in both catheter types high positive , but not significant . conclusion . the silver - coated catheters showed no significantly reduction in infection rate by evaluation of all collected data in this retrospective study . there was no association between both catheters in significantly reducing savings in treatment costs and in reducing patient discomfort . other new developed catheter materials such as the microdomain - structured inner and outer surface are considered more biocompatible because they mimic the structure of natural biological surface .",1
"the diversity of polyhydroxyalkanoates - producing bacteria in freshwater reservoirs in the ecology glacier foreland , antarctica , was examined by a cultivation - dependent method . isolated strains were analyzed phylogenetically by 16s rrna gene sequencing , and classified as members of alpha- , beta- , or gammaproteobacteria classes . polymerase chain reaction was used to detect pha synthase genes . potential polyhydroxyalkanoates ( phas ) producers belonging mainly to pseudomonas sp . , and janthinobacterium sp . were isolated from all five sampling sites , suggesting that pha synthesis is a common bacterial feature at pioneer sites . all pseudomonas strains had the genetic potential to synthesize medium - chain - length phas , whereas some isolated janthinobacterium strains might produce short - chain - length phas or medium - chain - length phas . it is the first report revealing that janthinobacterium species could have the potential to produce medium - chain - length phas .",1
"The human gut microbiome plays an essential role in maintaining intestinal homeostasis and protecting the host from pathogen invasion. It has been suggested that gut microbiome composition is altered in patients with inflammatory bowel disease (IBD). However, the causal relationship between microbiome composition and IBD remains unclear. In this study, we conducted a large meta-analysis of gut microbiome composition in IBD patients and healthy controls. Our results indicate that the gut microbiome of IBD patients is enriched in potentially pathogenic bacteria and depleted in beneficial bacteria. Specifically, we found a higher abundance of Escherichia coli, a known pathogen, in the IBD group, while the abundance of Bifidobacterium, a known probiotic, was reduced. We also observed an increase in inflammatory cytokine production in IBD patients compared to healthy controls. Our findings suggest that the gut microbiome may play a causal role in the development of IBD. This study highlights the importance of targeting the microbiome for IBD treatment. Targeting the microbiome with probiotics or other microbiome-based interventions",0
"anisotropic colloidal hybrid nanoparticles exhibit superior optical and physical properties compared to their counterparts with regular architectures . we herein developed a controlled , stepwise strategy to build novel , anisotropic , branched , gold nanoarchitectures ( au - tripods ) with predetermined composition and morphology for bioimaging . the resultant au - tripods with size less than 20 nm showed great promise as contrast agents for in vivo photoacoustic imaging ( pai ) . we further identified au - tripods with two possible configurations as high - absorbance nanomaterials from various gold multipods using a numerical simulation analysis . the pai signals were linearly correlated with their concentrations after subcutaneous injection . the in vivo biodistribution of au - tripods favorable for molecular imaging was confirmed using small animal positron emission tomography ( pet ) . intravenous administration of cyclic arg - gly - asp - d - phe - cys ( rgdfc ) peptide conjugated au - tripods ( rgd - au - tripods ) to u87 mg tumor - bearing mice showed pai contrasts in tumors almost 3-fold higher than for the blocking group . pai results correlated well with the corresponding pet images . quantitative biodistribution data revealed that 7.9% id / g of rgd - au - tripods had accumulated in the u87 mg tumor after 24 h post - injection . a pilot mouse toxicology study confirmed that no evidence of significant acute or systemic toxicity was observed in histopathological examination . our study suggests that au - tripods can be reliably synthesized through stringently controlled chemical synthesis and could serve as a new generation of platform with high selectivity and sensitivity for multimodality molecular imaging .",1
"Background: Frontotemporal dementia (FTD) is a progressive and fatal neurodegenerative disease. It has a prevalence of approximately 15 to 22 cases per 100,000 individuals in the US, affecting an estimated 350,000 people in the US. FTD is characterized by changes in personality and behaviors, difficulty with language, and problems with executive functioning. To date, no disease-modifying treatments are available for FTD.",0
"Background: Triple-negative breast cancer (TNBC) is an aggressive breast cancer that lacks treatment targets. Mutations in the breast cancer susceptibility gene 1 (BRCA1) are associated with a high risk of breast cancer. However, the contribution of BRCA1 mutations to TNBC is unknown.",0
"Patients with rheumatoid arthritis (RA) experience chronic pain and joint damage, which can lead to disability. The interleukin-6 (IL-6) signaling pathway has been implicated in RA pathology. The goal of this study was to evaluate the role of IL-6 signaling in the development of RA.",0
"purposeto investigate the relationship of transrectal ultrasound ( trus ) findings with the pathological characteristics of prostate cancer ( pca).materials and methodsthe study was conducted retrospectively by analyzing the data for 970 patients who underwent prostate biopsies . gleason scores and other clinical variables were compared between pca patients with and without hypoechoic lesions on trus.resultsof the 970 patients , pca was diagnosed in 291 ( 30% ) . of these , high - grade pca ( gleason score of 7 or more ) was diagnosed in 190 ( 65% ) . the cancer detection rate was higher in patients with hypoechoic lesions ( 43.9% ) than in those without hypoechoic lesions ( 21.4% , p<0.001 ) . high - grade pca was detected more often in patients with hypoechoic lesions than in those without hypoechoic lesions ( p<0.001 ) . independent predictors for high - grade pca by logistic regression analysis included hypoechoic lesions on trus and abnormal digital rectal examination findings.conclusionspatients with pca who had hypoechoic lesions on trus had more aggressive pathological disease than did those without lesions . therefore , hypoechoic lesions on trus could be a marker for clinically significant pca .",1
"objectivemedically unexplained somatic complaints are highly prevalent , and lead to significant impairment and disability . the number of effective treatment modalities for somatic symptom and related disorders ( ssds ) or somatoform disorders ( sds ) remains limited . to date , there is no formal indication for electroconvulsive therapy ( ect ) in ssd or sd . we report on the largest case series to date regarding the effectiveness of ect in patients with ssd and sd.methodsa retrospective chart review of all patients treated with an index course of ect at the neuropsychiatric program at the university of british columbia hospital from 2000 to 2010 was conducted . the primary outcomes consisted of changes in pseudoneurologic symptoms , pain symptoms , cardiopulmonary symptoms , and gastrointestinal symptoms . complaints were examined pre- and post-ect.resultstwenty-eight participants were included in this study . twenty - one participants received right unilateral ect . six received bifrontal ect . one received bitemporal ect . eighteen of 21 participants reported improvement in pseudoneurologic symptoms ; eleven of 14 participants reported improvement in pain symptoms ; one participant reported improvement in cardiopulmonary symptoms ; and one of two participants reported improvement in gastrointestinal symptoms . this paper discusses the putative mechanism of action of ect in the treatment of sd / ssd.conclusionthis retrospective study suggests that ect could be included as part of the existing treatment for refractory ssd and sd , particularly in refractory cases with comorbid mood disorders .",1
